[
  {
    "Unit Name": "Dwarf King",
    "Nation": "Dwarf",
    "Terrain": [
      "Capital Dwarf City"
    ],
    "A": 4,
    "M": 5,
    "F": 4,
    "S": 0,
    "D": 11,
    "CD": 3,
    "H": 3,
    "Pts": 322,
    "Special": [
      "Command (2)"
    ],
    "Base": "25 x 25",
    "Equipment": [
      "Hand Weapon"
    ]
  },
  {
    "Unit Name": "Dwarf Prince",
    "Nation": "Dwarf",
    "Terrain": [
      "Capital Dwarf City"
    ],
    "A": 4,
    "M": 5,
    "F": 3,
    "S": 0,
    "D": 11,
    "CD": 2,
    "H": 2,
    "Pts": 165,
    "Special": [
      "Command (1)"
    ],
    "Base": "25 x 25",
    "Equipment": [
      "Hand Weapon"
    ]
  },
  {
    "Unit Name": "Dwarf General",
    "Nation": "Dwarf",
    "Terrain": [
      "Dwarf City"
    ],
    "A": 4,
    "M": 5,
    "F": 3,
    "S": 0,
    "D": 11,
    "CD": 1,
    "H": 2,
    "Pts": 293,
    "Special": [
      "Command (2)"
    ],
    "Base": "25 x 25",
    "Equipment": [
      "Hand Weapon"
    ]
  },
  {
    "Unit Name": "Dwarf Captain",
    "Nation": "Dwarf",
    "Terrain": [
      "Dwarf City"
    ],
    "A": 4,
    "M": 5,
    "F": 3,
    "S": 0,
    "D": 11,
    "CD": 1,
    "H": 1,
    "Pts": 150,
    "Special": [
      "Command (1)",
      "Shielding (1)",
      "Magic Items"
    ],
    "Base": "25 x 25",
    "Equipment": [
      "Hand Weapon",
      "Shield",
      "Heavy Armour"
    ]
  },
  {
    "Unit Name": "Dwarf Champion",
    "Nation": "Dwarf",
    "Terrain": [
      "Dwarf City"
    ],
    "A": 4,
    "M": 5,
    "F": 4,
    "S": 0,
    "D": 11,
    "CD": 3,
    "H": 1,
    "Pts": 62,
    "Special": [
      "Champion",
      "Shielding (1)",
      "Magic Items"
    ],
    "Base": "25 x 25",
    "Equipment": [
      "Hand Weapon",
      "Shield",
      "Heavy Armour"
    ]
  },
  {
    "Unit Name": "Dwarf Spellcaster 1",
    "Nation": "Dwarf",
    "Terrain": [
      "Dwarf City"
    ],
    "A": 4,
    "M": 5,
    "F": 2,
    "S": 0,
    "D": 9,
    "CD": 3,
    "H": 2,
    "Pts": 30,
    "Special": [
      "Spellcaster (1)"
    ],
    "Base": "25 x 25",
    "Equipment": [
      "Hand Weapon"
    ]
  },
  {
    "Unit Name": "Dwarf Spellcaster 2",
    "Nation": "Dwarf",
    "Terrain": [
      "Dwarf City"
    ],
    "A": 4,
    "M": 5,
    "F": 2,
    "S": 0,
    "D": 9,
    "CD": 3,
    "H": 2,
    "Pts": 60,
    "Special": [
      "Spellcaster (2)"
    ],
    "Base": "25 x 25",
    "Equipment": [
      "Hand Weapon"
    ]
  },
  {
    "Unit Name": "Dwarf Spellcaster 3",
    "Nation": "Dwarf",
    "Terrain": [
      "Hermitage"
    ],
    "A": 4,
    "M": 5,
    "F": 2,
    "S": 0,
    "D": 9,
    "CD": 3,
    "H": 2,
    "Pts": 110,
    "Special": [
      "Spellcaster (3)"
    ],
    "Base": "25 x 25",
    "Equipment": [
      "Hand Weapon"
    ]
  },
  {
    "Unit Name": "Dwarf Spellcaster 4",
    "Nation": "Dwarf",
    "Terrain": [
      "Hermitage"
    ],
    "A": 4,
    "M": 5,
    "F": 2,
    "S": 0,
    "D": 9,
    "CD": 3,
    "H": 3,
    "Pts": 200,
    "Special": [
      "Spellcaster (4)"
    ],
    "Base": "25 x 25",
    "Equipment": [
      "Hand Weapon"
    ]
  },
  {
    "Unit Name": "Dwarf Spellcaster 5",
    "Nation": "Dwarf",
    "Terrain": [
      "Hermitage"
    ],
    "A": 4,
    "M": 5,
    "F": 2,
    "S": 0,
    "D": 9,
    "CD": 3,
    "H": 3,
    "Pts": 270,
    "Special": [
      "Spellcaster (5)"
    ],
    "Base": "25 x 25",
    "Equipment": [
      "Hand Weapon"
    ]
  },
  {
    "Unit Name": "Dwarf Soldier",
    "Nation": "Dwarf",
    "Terrain": [
      "Dwarf City"
    ],
    "A": 4,
    "M": 5,
    "F": 2,
    "S": 0,
    "D": 10,
    "CD": 1,
    "H": 1,
    "Pts": 15,
    "Special": [
      "Shielding (1)"
    ],
    "Base": "25 x 25",
    "Equipment": [
      "Hand Weapon"
    ]
  },
  {
    "Unit Name": "Dwarf Spearman",
    "Nation": "Dwarf",
    "Terrain": [
      "Dwarf City"
    ],
    "A": 4,
    "M": 5,
    "F": 2,
    "S": 0,
    "D": 10,
    "CD": 1,
    "H": 1,
    "Pts": 16,
    "Special": [
      "Shielding (1)"
    ],
    "Base": "25 x 25",
    "Equipment": [
      "Equipment: Spear"
    ]
  },
  {
    "Unit Name": "Dwarf Archer",
    "Nation": "Dwarf",
    "Terrain": [
      "Dwarf City"
    ],
    "A": 4,
    "M": 5,
    "F": 0,
    "S": 2,
    "D": 10,
    "CD": 1,
    "H": 1,
    "Pts": 15,
    "Special": [
      "Fire Over"
    ],
    "Base": "25 x 25",
    "Equipment": [
      "Equipment: Hand Weapon"
    ]
  },
  {
    "Unit Name": "Dwarf Warrior",
    "Nation": "Dwarf",
    "Terrain": [
      "Forges"
    ],
    "A": 4,
    "M": 4,
    "F": 2,
    "S": 1,
    "D": 11,
    "CD": 1,
    "H": 1,
    "Pts": 17,
    "Special": [
      "Shielding (1)"
    ],
    "Base": "25 x 25",
    "Equipment": [
      "Equipment: Hand Weapon"
    ]
  },
  {
    "Unit Name": "Dwarf Linebreaker",
    "Nation": "Dwarf",
    "Terrain": [
      "Forges"
    ],
    "A": 4,
    "M": 4,
    "F": 3,
    "S": 0,
    "D": 11,
    "CD": 1,
    "H": 1,
    "Pts": 20,
    "Special": [],
    "Base": "25 x 25",
    "Equipment": [
      "Two-Handed Weapon",
      "Heavy Armour"
    ]
  },
  {
    "Unit Name": "Dwarf Light Catapult",
    "Nation": "Dwarf",
    "Terrain": [
      "Lumber Yard"
    ],
    "A": 4,
    "M": 3,
    "F": 2,
    "S": 3,
    "D": 9,
    "CD": 1,
    "H": 1,
    "Pts": 120,
    "Special": [
      "Artillery"
    ],
    "Base": "100 x 50",
    "Equipment": [
      "Hand Weapon"
    ]
  },
  {
    "Unit Name": "Dwarf Heavy Catapult",
    "Nation": "Dwarf",
    "Terrain": [
      "Lumber Yard"
    ],
    "A": 4,
    "M": 2,
    "F": 2,
    "S": 4,
    "D": 9,
    "CD": 1,
    "H": 1,
    "Pts": 140,
    "Special": [
      "Artillery"
    ],
    "Base": "100 x 50",
    "Equipment": [
      "Hand Weapon"
    ]
  },
  {
    "Unit Name": "Indrik",
    "Nation": "Dwarf",
    "Terrain": [
      "Snow-capped Mountains"
    ],
    "A": 6,
    "M": 6,
    "F": 2,
    "S": 0,
    "D": 12,
    "CD": 4,
    "H": 5,
    "Pts": 160,
    "Special": [
      "Monster"
    ],
    "Base": "50 x 50",
    "Equipment": [
      ""
    ]
  },
  {
    "Unit Name": "Eachy",
    "Nation": "Dwarf",
    "Terrain": [
      "Tarns"
    ],
    "A": 7,
    "M": 5,
    "F": 4,
    "S": 0,
    "D": 12,
    "CD": 3,
    "H": 5,
    "Pts": 120,
    "Special": [
      "Monster"
    ],
    "Base": "50 x 50",
    "Equipment": [
      ""
    ]
  },
  {
    "Unit Name": "Barghest",
    "Nation": "Dwarf",
    "Terrain": [
      "Moors"
    ],
    "A": 4,
    "M": 8,
    "F": 3,
    "S": 0,
    "D": 11,
    "CD": 4,
    "H": 4,
    "Pts": 200,
    "Special": [
      "Monster"
    ],
    "Base": "50 x 50",
    "Equipment": []
  },
  {
    "Unit Name": "Human King",
    "Nation": "Human",
    "Terrain": [
      "Human Capital City"
    ],
    "A": 5,
    "M": 6,
    "F": 4,
    "S": 0,
    "D": 10,
    "CD": 3,
    "H": 3,
    "Pts": 279,
    "Special": [
      "Command (2)"
    ],
    "Base": "25 x 25",
    "Equipment": [
      "Hand Weapon"
    ]
  },
  {
    "Unit Name": "Human Prince",
    "Nation": "Human",
    "Terrain": [
      "Human Capital City"
    ],
    "A": 5,
    "M": 6,
    "F": 3,
    "S": 0,
    "D": 10,
    "CD": 2,
    "H": 2,
    "Pts": 145,
    "Special": [
      "Command (1)"
    ],
    "Base": "25 x 25",
    "Equipment": [
      "Hand Weapon"
    ]
  },
  {
    "Unit Name": "Human General",
    "Nation": "Human",
    "Terrain": [
      "Human City"
    ],
    "A": 5,
    "M": 6,
    "F": 3,
    "S": 0,
    "D": 10,
    "CD": 1,
    "H": 2,
    "Pts": 260,
    "Special": [
      "Command (2)"
    ],
    "Base": "25 x 25",
    "Equipment": [
      "Hand Weapon"
    ]
  },
  {
    "Unit Name": "Human Captain",
    "Nation": "Human",
    "Terrain": [
      "Human City"
    ],
    "A": 5,
    "M": 6,
    "F": 3,
    "S": 0,
    "D": 10,
    "CD": 1,
    "H": 1,
    "Pts": 133,
    "Special": [
      "Command (1)"
    ],
    "Base": "25 x 25",
    "Equipment": [
      "Hand Weapon"
    ]
  },
  {
    "Unit Name": "Human Champion",
    "Nation": "Human",
    "Terrain": [
      "Human City"
    ],
    "A": 5,
    "M": 6,
    "F": 4,
    "S": 0,
    "D": 10,
    "CD": 3,
    "H": 1,
    "Pts": 51,
    "Special": [
      "Champion"
    ],
    "Base": "25 x 25",
    "Equipment": [
      "Hand Weapon"
    ]
  },
  {
    "Unit Name": "Human Spellcaster 1",
    "Nation": "Human",
    "Terrain": [
      "Human City"
    ],
    "A": 5,
    "M": 6,
    "F": 2,
    "S": 0,
    "D": 8,
    "CD": 3,
    "H": 2,
    "Pts": 50,
    "Special": [
      "Spellcaster (1)"
    ],
    "Base": "25 x 25",
    "Equipment": [
      "Hand Weapon"
    ]
  },
  {
    "Unit Name": "Human Spellcaster 2",
    "Nation": "Human",
    "Terrain": [
      "Human City"
    ],
    "A": 5,
    "M": 6,
    "F": 2,
    "S": 0,
    "D": 8,
    "CD": 3,
    "H": 2,
    "Pts": 100,
    "Special": [
      "Spellcaster (2)"
    ],
    "Base": "25 x 25",
    "Equipment": [
      "Hand Weapon"
    ]
  },
  {
    "Unit Name": "Human Spellcaster 3",
    "Nation": "Human",
    "Terrain": [
      "Monastery"
    ],
    "A": 5,
    "M": 6,
    "F": 2,
    "S": 0,
    "D": 8,
    "CD": 3,
    "H": 2,
    "Pts": 200,
    "Special": [
      "Spellcaster (3)"
    ],
    "Base": "25 x 25",
    "Equipment": [
      "Hand Weapon"
    ]
  },
  {
    "Unit Name": "Human Spellcaster 4",
    "Nation": "Human",
    "Terrain": [
      "Monastery"
    ],
    "A": 5,
    "M": 6,
    "F": 2,
    "S": 0,
    "D": 8,
    "CD": 3,
    "H": 3,
    "Pts": 300,
    "Special": [
      "Spellcaster (4)"
    ],
    "Base": "25 x 25",
    "Equipment": [
      "Hand Weapon"
    ]
  },
  {
    "Unit Name": "Human Spellcaster 5",
    "Nation": "Human",
    "Terrain": [
      "Monastery"
    ],
    "A": 5,
    "M": 6,
    "F": 2,
    "S": 0,
    "D": 8,
    "CD": 3,
    "H": 3,
    "Pts": 400,
    "Special": [
      "Spellcaster (5)"
    ],
    "Base": "25 x 25",
    "Equipment": [
      "Hand Weapon"
    ]
  },
  {
    "Unit Name": "Human Soldier",
    "Nation": "Human",
    "Terrain": [